id;type;section_id;section_name;web_publication_date;web_title;web_url;api_url;tags;is_hosted;pillar_id;pillar_name;headline;standfirst;trail_text;byline;main;body;newspaper_page_number;wordcount;comment_close_date;commentable;first_publication_date;is_inappropriate_for_sponsorship;is_premoderated;last_modified;newspaper_edition_date;production_office;publication;short_url;should_hide_adverts;show_in_related_content;thumbnail;legally_sensitive;lang;is_live;body_text;char_count;should_hide_reader_revenue;show_affiliate_links;byline_html;live_blogging_now;allow_ugc;sensitive;
politics/2015/may/10/traumatised-by-the-election-result-a-psychotherapists-recovery-guide;article;politics;Politics;2015-05-10T15:00:05Z;Traumatised by the election result? A psychotherapist's recovery guide;https://www.theguardian.com/politics/2015/may/10/traumatised-by-the-election-result-a-psychotherapists-recovery-guide;https://content.guardianapis.com/politics/2015/may/10/traumatised-by-the-election-result-a-psychotherapists-recovery-guide;;FALSE;pillar/news;News;Traumatised by the election result? A psychotherapist's recovery guide;You’re probably still in shock. You’re most likely angry and you want someone to blame. But you’ve got to find a way to move onWhat bright side? There’s no silver lining to this election;You’re probably still in shock. You’re most likely angry and you want someone to blame. But you’ve got to find a way to move on;Philippa Perry;"<figure class=""element element-image"" data-media-id=""gu-fc-f59c9430-e25b-4d04-8733-a9a172cbd316""> <img src=""http://static.guim.co.uk/sys-images/Guardian/Pix/pictures/2015/5/8/1431108017668/4fdf1932-b25b-4e72-a167-ac6d8e08cf08-460x276.jpeg"" alt=""smile"" width=""460"" height=""276"" class=""gu-image"" /> <figcaption> <span class=""element-image__caption"">smile</span> <span class=""element-image__credit"">Photograph: Guardian</span> </figcaption> </figure>";"<p><strong>Be sad, be sorry.</strong> <strong>You don’t have to smile or pretend everything’s OK.</strong></p> <p>It felt like a punch in the stomach when I saw the exit polls. It was a shock. I woke up at about 6am, looked at Twitter and couldn’t stop crying. I had allowed myself to get hopeful and these were tears of disappointment.</p> <p>I feel so sad about Ed Miliband resigning. In the past weeks he was getting into his stride, becoming more confident at being himself, being someone we could relate to and trust. It’s like the breakup of a relationship and you have to give yourself time to adjust. You can’t expect to feel better tomorrow. But I expect to regain full equilibrium within a month.</p> <p><strong>Try not to hate, or to blame, or think of things in extreme terms of right or wrong.</strong></p> <p>When we have a shock, we go into black-and-white thinking. We need to get out of this. If we are hating and blaming, we are not going to be functional. Check your mindset. Don’t think we’re doomed. You need to observe yourself being angry and hateful, notice that it’s a phase you are going through and know that there is something more useful you are going to do. Feeling glee for more than moments about the Lib Dem or Ukip defeat is all-or-nothing thinking. It’s grabbing comfort where you can and is of no lasting benefit.</p> <p><strong>Feeling helpless and impotent is not great for getting over feeling sad.</strong></p> <p>Do something – join a political party to get involved in policy-making. I noticed on social media that a number of people intend to do just this.</p> <p><strong>We must slow down discussions. </strong></p> <p>We need to try to understand the other rather than shout over them. Nobody is going to change their mind if someone shouts at them or dismisses them. What the Conservatives have done is make a connection with the electorate that Labour failed to. We feel connected with our tribe and think everyone feels the same, but this election has shown that other people don’t know what we are on about.</p>  <figure class=""element element-image"" data-media-id=""ce21060dd25b7e3f0c6cfa5733b5a864f5455121""> <img src=""https://static.guim.co.uk/sys-images/Guardian/Pix/pictures/2015/5/8/1431108723390/d80d05c4-da44-4643-89cc-e07d9b2f1fe6-460x276.jpeg"" alt=""Philippa Perry's fruit therapy"" width=""460"" height=""276"" class=""gu-image"" /> <figcaption> <span class=""element-image__caption"">Philippa Perry’s fruit therapy.</span> <span class=""element-image__credit"">Photograph: Philippa Perry</span> </figcaption> </figure>  <p><strong>Don’t write anyone off as plain evil.</strong><br></p> <p>Let’s stop assuming the worst of our so-called enemies. We need to learn to empathise and to make an effort to understand the feelings beneath the behaviour of people who voted for rightwing parties. It’s tempting to write them off as uncaring, selfish or persecutory, but that won’t solve anything. I need to feel what it’s like to believe that someone is after all my money and resources and imagine what it’s like to think people coming into this country will not add to our resources but take them away. Hating the electorate for being stupid, however satisfying in the short-term, will make things much worse. I think probably everyone means well in their own way. If I think that, I start to feel more upbeat and less despairing.</p> <p><strong>However much you may despise some of the Conservative philosophy, it is not necessarily all bad.</strong></p> <p>Look – they got gay marriage through. Let’s not look for the worst and be forever cynical. It won’t make us happier or solve anything.</p> <p><strong>Do something to self-nurture.</strong> Spend some time with like-minded friends so you can console each other. It may sound silly but after drawing faces on fruit with a friend on Friday morning, I started to feel a bit better. We spent time face to face and concentrated on something that wasn’t about how sad we felt. Joke, even if the humour is dark. My husband had to catch a flight on Friday. I took a picture of him on the pavement holding his passport and tweeted: “Grayson’s leaving the country. I’m gonna miss him.”</p> <p>Drawing, reading, knitting – do whatever it is you need to do to regroup and pick yourself up.</p>";8;637;2015-05-13T15:00:05Z;TRUE;2015-05-10T15:00:05Z;FALSE;FALSE;2017-11-25T07:40:40Z;11/05/15;UK;The Guardian;https://www.theguardian.com/p/488mp;FALSE;TRUE;NA;NA;en;TRUE;Be sad, be sorry. You don’t have to smile or pretend everything’s OK. It felt like a punch in the stomach when I saw the exit polls. It was a shock. I woke up at about 6am, looked at Twitter and couldn’t stop crying. I had allowed myself to get hopeful and these were tears of disappointment. I feel so sad about Ed Miliband resigning. In the past weeks he was getting into his stride, becoming more confident at being himself, being someone we could relate to and trust. It’s like the breakup of a relationship and you have to give yourself time to adjust. You can’t expect to feel better tomorrow. But I expect to regain full equilibrium within a month. Try not to hate, or to blame, or think of things in extreme terms of right or wrong. When we have a shock, we go into black-and-white thinking. We need to get out of this. If we are hating and blaming, we are not going to be functional. Check your mindset. Don’t think we’re doomed. You need to observe yourself being angry and hateful, notice that it’s a phase you are going through and know that there is something more useful you are going to do. Feeling glee for more than moments about the Lib Dem or Ukip defeat is all-or-nothing thinking. It’s grabbing comfort where you can and is of no lasting benefit. Feeling helpless and impotent is not great for getting over feeling sad. Do something – join a political party to get involved in policy-making. I noticed on social media that a number of people intend to do just this. We must slow down discussions. We need to try to understand the other rather than shout over them. Nobody is going to change their mind if someone shouts at them or dismisses them. What the Conservatives have done is make a connection with the electorate that Labour failed to. We feel connected with our tribe and think everyone feels the same, but this election has shown that other people don’t know what we are on about. Don’t write anyone off as plain evil. Let’s stop assuming the worst of our so-called enemies. We need to learn to empathise and to make an effort to understand the feelings beneath the behaviour of people who voted for rightwing parties. It’s tempting to write them off as uncaring, selfish or persecutory, but that won’t solve anything. I need to feel what it’s like to believe that someone is after all my money and resources and imagine what it’s like to think people coming into this country will not add to our resources but take them away. Hating the electorate for being stupid, however satisfying in the short-term, will make things much worse. I think probably everyone means well in their own way. If I think that, I start to feel more upbeat and less despairing. However much you may despise some of the Conservative philosophy, it is not necessarily all bad. Look – they got gay marriage through. Let’s not look for the worst and be forever cynical. It won’t make us happier or solve anything. Do something to self-nurture. Spend some time with like-minded friends so you can console each other. It may sound silly but after drawing faces on fruit with a friend on Friday morning, I started to feel a bit better. We spent time face to face and concentrated on something that wasn’t about how sad we felt. Joke, even if the humour is dark. My husband had to catch a flight on Friday. I took a picture of him on the pavement holding his passport and tweeted: “Grayson’s leaving the country. I’m gonna miss him.” Drawing, reading, knitting – do whatever it is you need to do to regroup and pick yourself up.;3528;NA;NA;"<span data-tag-id=""49490"" class=""contributor"">Philippa Perry</span>";NA;NA;NA;
commentisfree/2015/apr/01/colouring-in-adults-free-your-mind-play;article;commentisfree;Opinion;2015-04-01T12:49:50Z;Colouring in can free your mind. Let’s learn how to play again | Philippa Perry;https://www.theguardian.com/commentisfree/2015/apr/01/colouring-in-adults-free-your-mind-play;https://content.guardianapis.com/commentisfree/2015/apr/01/colouring-in-adults-free-your-mind-play;;FALSE;pillar/opinion;Opinion;Colouring in can free your mind. Let’s learn how to play again;It’s cheering that a colouring book for adults is topping bestseller lists, because as we get older it’s easy to forget about the joy – and learning potential – of play;It’s cheering that a colouring book for adults is topping bestseller lists, because as we get older it’s easy to forget about the joy – and learning potential – of play;Philippa Perry;"<figure class=""element element-image"" data-media-id=""32b541d72127c86a20705c5c3576fc6383c69baf""> <img src=""http://static.guim.co.uk/sys-images/Guardian/Pix/pictures/2015/4/1/1427895991139/Johanna-Basfords-Secret-G-005.jpg"" alt=""Johanna Basford's Secret Garden"" width=""460"" height=""276"" class=""gu-image"" /> <figcaption> <span class=""element-image__caption"">‘Colouring in is not a passive act: you need to make creative decisions about which colours to choose and, while you concentrate on not going over the lines, other parts of your mind may be freed up in ways that allow you to become more creative.’ Photograph: Johanna Basford and Laurence King</span> <span class=""element-image__credit"">Photograph: Johanna Basford and Laurence King</span> </figcaption> </figure>";<p>As George Bernard Shaw once said: “We don’t stop playing because we grow old;;;;;;;;;;;;;;;;;;;;;;;;;;;
lifeandstyle/2015/feb/20/what-is-your-earliest-memory;article;lifeandstyle;Life and style;2015-02-20T15:13:27Z;What is your earliest memory?;https://www.theguardian.com/lifeandstyle/2015/feb/20/what-is-your-earliest-memory;https://content.guardianapis.com/lifeandstyle/2015/feb/20/what-is-your-earliest-memory;;FALSE;pillar/lifestyle;Lifestyle;What is your earliest memory?;Where were you? Who else was there? What were you doing? We asked five contributors to share their first recollection and we want to know yours too. To contribute, go to GuardianWitness and upload your image. We will choose five to run in a subsequent issue of the Family section;Where were you? Who else was there? What were you doing? We asked five contributors to share their first recollection and we want to know yours too.;Sarfraz ManzoorJohn-Paul FlintoffSteven ApplebyPhilippa PerryAdam Murphy;"<figure class=""element element-image"" data-media-id=""gu-fc-3567b2e8-0c8b-45c0-92c4-3649dbfe73e9""> <img src=""http://static.guim.co.uk/sys-images/Guardian/Pix/pictures/2015/2/17/1424193472081/822ea47f-1e01-453b-80ac-22e1d604ff43-460x276.jpeg"" alt=""Sarfraz Manzoor's earliest memory collage"" width=""460"" height=""276"" class=""gu-image"" /> <figcaption> <span class=""element-image__caption"">A detail from Sarfraz Manzoor’s memory picture. See the full collage below.</span> <span class=""element-image__credit"">Composite: Sarfraz Manzoor</span> </figcaption> </figure>";"<figure class=""element element-image"" data-media-id=""44a6531c31fbcd586fb57fdada38a6355ca8d4c7""> <img src=""https://static.guim.co.uk/sys-images/Guardian/Pix/pictures/2015/2/17/1424194319826/9ce99d58-50ef-483a-aa95-7e2f633ffb06-460x326.jpeg"" alt=""Sarfraz Manzoor's earliest memory"" width=""460"" height=""326"" class=""gu-image"" /> <figcaption> <span class=""element-image__caption"">Sarfraz Manzoor, writer and broadcaster: ‘My mother is old and frail now and needs her children to tolerate and take care of her. It’s not always easy. Making this collage reminded me why we do it, and took me back to a time when Mum struggled and sacrificed for us. It reminded me of the debt her children owe her – a debt that can never be fully repaid.’ </span> <span class=""element-image__credit"">Composite: Sarfraz Manzoor</span> </figcaption> </figure>  <figure class=""element element-image"" data-media-id=""099db84776f459696ac0bf3240a2a495d32d33f2""> <img src=""https://static.guim.co.uk/sys-images/Guardian/Pix/pictures/2015/2/17/1424191676684/2c289221-379a-4fea-8ac5-f7ef45d1723d-304x420.jpeg"" alt=""Philippa Perry's earliest memory"" width=""304"" height=""420"" class=""gu-image"" /> <figcaption> <span class=""element-image__caption"">Philippa Perry is a psychotherapist, <a href=""http://www.theguardian.com/lifeandstyle/video/2015/feb/06/mother-drank-death-grandma-blames-me-agony-aunt-problem-video"">agony aunt</a> and the author of <a href=""http://bookshop.theguardian.com/how-to-stay-sane.html"">How to Stay Sane</a> (Macmillan): ‘I tried to re-immerse myself in the memory – myopic close-up textures and smells. I must have always been shortsighted.’ </span> <span class=""element-image__credit"">Illustration: Philippa Perry</span> </figcaption> </figure>  <figure class=""element element-image"" data-media-id=""55f2553f2c9989ac2735d9d62f08f9dc319553bf""> <img src=""https://static.guim.co.uk/sys-images/Guardian/Pix/pictures/2015/2/17/1424191781403/47f56c82-e011-46c7-b015-87c48bbc1ee1-460x457.jpeg"" alt=""Steven Appleby's earliest memory"" width=""460"" height=""457"" class=""gu-image"" /> <figcaption> <span class=""element-image__caption"">Steven Appleby, illustrator and Guardian Family cartoonist: ‘It was tricky trying to think back and find my first memory but I really enjoyed it. My parents are both dead so there’s no one to ask. Remembering back to early childhood gave me a lovely, comfortable feeling.’ </span> <span class=""element-image__credit"">Illustration: Steven Appleby</span> </figcaption> </figure>  <figure class=""element element-image"" data-media-id=""a6414e6db1df6bcf2fee52348dc93a899ec28b64""> <img src=""https://static.guim.co.uk/sys-images/Guardian/Pix/pictures/2015/2/17/1424191972154/9d296ce3-cd30-45f0-8932-60aac951c822-460x367.jpeg"" alt=""Adam Murphy's earliest memory"" width=""460"" height=""367"" class=""gu-image"" /> <figcaption> <span class=""element-image__caption"">Adam Murphy is the author of <a href=""http://bookshop.theguardian.com/corpse-talk.html"">Corpse Talk</a> (David Fickling Books): ‘While drawing, <br> I rediscovered all sorts of details, like the thumbs the monkey could stick in its ears and nose.’ </span> <span class=""element-image__credit"">Illustration: Adam Murphy</span> </figcaption> </figure>  <figure class=""element element-image"" data-media-id=""b37933f4647914b724d28e4ac7a0c07c4b4d1683""> <img src=""https://static.guim.co.uk/sys-images/Guardian/Pix/pictures/2015/2/20/1424445905360/1b1e54f4-cefc-42f8-b0fe-03e748a79d24-260x420.jpeg"" alt=""My earliest memory John-Paul Flintoff"" width=""260"" height=""420"" class=""gu-image"" /> <figcaption> <span class=""element-image__caption"">John-Paul Flintoff, writer and broadcaster, is co-author of The Family Project. ‘It was odd to remember that my brother was once a stranger. Drawing my sister, who now lives in Australia, made me miss her terribly. I think of her every day.’</span> <span class=""element-image__credit"">Photograph: Guardian</span> </figcaption> </figure>  <figure class=""element element-image"" data-media-id=""44b1e66927806828152eb108ec48b6fb0d4595a5""> <img src=""https://static.guim.co.uk/sys-images/Guardian/Pix/pictures/2015/2/17/1424195465654/86ad3216-9ee3-41b4-9967-612b68615d1e-1020x1020.jpeg"" alt=""The Family Project"" width=""1020"" height=""1020"" class=""gu-image"" /> <figcaption> <span class=""element-image__caption"">This exercise is taken from The Family Project, a creative handbook for learning more about your family. What would you have written or drawn? To contribute your own earliest memory, go to Guardian Witness at <a href=""http://witness.theguardian.com"">witness.theguardian.com</a> and upload your image. We will choose five to run in a subsequent issue of Family. <br><br><em> The Family Project by John-Paul Flintoff and Harriet Green is published by Guardian Faber, £12.99. To order The Family Project for £10, visit <a href=""http://bookshop.theguardian.com/family-project.html"">theguardian.com/family-project </a>or call the Guardian Bookshop on 0330 333 6846</em></span> <span class=""element-image__credit"">Illustration: Guardian</span> </figcaption> </figure>";NA;0;2015-02-26T23:00:00Z;TRUE;2015-02-20T15:13:27Z;FALSE;FALSE;2017-09-20T10:51:47Z;NA;UK;theguardian.com;https://www.theguardian.com/p/45q9v;FALSE;TRUE;NA;NA;en;TRUE;;0;NA;NA;"<a href=""profile/sarfrazmanzoor"">Sarfraz Manzoor</a><span data-tag-id=""60127"" class=""contributor"">John-Paul Flintoff</span><a href=""profile/steven-appleby"">Steven Appleby</a><a href=""profile/philippa-perry"">Philippa Perry</a>Adam Murphy";NA;NA;NA;
commentisfree/2015/feb/04/lance-armstrong-liar-no-other-way;article;commentisfree;Opinion;2015-02-04T12:33:46Z;Lance Armstrong is a pathological liar. What if he knows no other way? | Philippa Perry;https://www.theguardian.com/commentisfree/2015/feb/04/lance-armstrong-liar-no-other-way;https://content.guardianapis.com/commentisfree/2015/feb/04/lance-armstrong-liar-no-other-way;;FALSE;pillar/opinion;Opinion;Lance Armstrong is a pathological liar. What if he knows no other way?;We all tell lies. But sometimes we learn from our upbringing that lying brings rewards or that we’re special and above the law;We all tell lies. But sometimes we learn from our upbringing that lying brings rewards or that we’re special and above the law;Philippa Perry;"<figure class=""element element-image"" data-media-id=""650ddda8d38e87227a410d38b9e4808960971be1""> <img src=""http://static.guim.co.uk/sys-images/Guardian/Pix/pictures/2015/2/4/1423055114576/Lance-Armstrong-005.jpg"" alt=""Lance Armstrong"" width=""460"" height=""276"" class=""gu-image"" /> <figcaption> <span class=""element-image__caption"">Lance Armstrong in the film The Armstrong Lie. Photograph: Maryse Alberti/AP</span> <span class=""element-image__credit"">Photograph: Maryse Alberti/AP</span> </figcaption> </figure>";"<p>Lance Armstrong <a href=""http://www.theguardian.com/sport/2015/feb/03/lance-armstrong-let-partner-take-blame-for-car-accident"" title="""">has been caught lying</a>. Again. He got his girlfriend to take the blame for a car accident that was his fault. Why do some people seem to habitually lie?</p> <p>What follows is just a theory, I’m not saying it’s fact, but it is the narrative I use to make sense of lying.</p> <p>Unless you are on the autistic spectrum and don’t know how, everybody lies";;;;;;;;;;;;;;;;;;;;;;;;;;;
commentisfree/2015/jan/29/celebrity-gossip;article;commentisfree;Opinion;2015-01-29T15:13:59Z;Why celebrity gossip is a sport we should all practise seriously | Philippa Perry;https://www.theguardian.com/commentisfree/2015/jan/29/celebrity-gossip;https://content.guardianapis.com/commentisfree/2015/jan/29/celebrity-gossip;;FALSE;pillar/opinion;Opinion;Why celebrity gossip is a sport we should all practise seriously;Men may dismiss gossip as women’s tittle tattle: but a new paper suggests it is good for you;Men may dismiss gossip as women’s tittle tattle: but a new paper suggests it is good for you;Philippa Perry;"<figure class=""element element-image"" data-media-id=""0ecd0986d3c410d07918ee35f03465c3a2d70c60""> <img src=""http://static.guim.co.uk/sys-images/Guardian/Pix/pictures/2015/1/29/1422537185014/SYLVESTER-McCOY-as-MR-BEN-005.jpg"" alt=""SYLVESTER McCOY as MR BENNET"" width=""460"" height=""276"" class=""gu-image"" /> <figcaption> <span class=""element-image__caption"">Rula Lenska and Sylvester McCoy as Mr and Mrs Bennet in Pride and Prejudice: 'He knew that gossip was an important part of life.' Photograph: Tristram Kenton</span> <span class=""element-image__credit"">Photograph: Tristram Kenton</span> </figcaption> </figure>";"<p>We tend to disapprove of gossip, perhaps because we fear being slurred by others behind our back. Gossip today is generally assumed to be a female occupation, and is often belittled by males. Men may be more likely to be <a href=""http://en.wikipedia.org/wiki/Alexithymia"" title="""">alexithymic</a> and may not understand the nuance of gossip, meaning they dismiss it as meaningless rather than admit a lack of understanding. But if we go back to the etymology of the word, we can see what gossip is really about – a <a href=""http://www.oxforddictionaries.com/definition/english/gossip"" title="""">person related to one in God</a>. In secular terms we may interpret this as a person with whom we have a bond, and that’s what gossip is really for. It is for bonding and, it is most certainly for both genders.</p> <p>In <a href=""http://www.theguardian.com/books/interactive/2013/jan/26/pride-and-prejudice-jane-austen-interactive"" title="""">Pride and Prejudice</a>, Mr Bennet says: “But, Lizzie, you look as if you did not enjoy it. You are not going to be missish, I hope, and pretend to be affronted at an idle report. <a href=""http://www.austenquotes.com/for-what-do-we/"" title="""">For what do we live, but to make sport for our neighbors, and laugh at them in our turn</a>?” Jane Austen’s wry character was, of course, a lover of the ironic. He did believe, I am sure, that there was more to our existence than making sport for our neighbours, but he also knew that gossip was an important part of life and a glue that helps to bond us. Humans are pack animals: we do not thrive without attachment to others. We need a tribe, and gossip is an important ingredient in holding that tribe together.</p> <p>These days the people making the most sport for us are celebrities, but we don’t like to admit it. In a <a href=""http://www.ncbi.nlm.nih.gov/pubmed/25580932"" title="""">recent paper</a> published in the Journal of Social Neuroscience, scientists outlined how they scanned people’s brains to see how they reacted to different types of gossip. Although participants in the study did not report being particularly happy upon hearing negative gossip about celebrities, the significantly enhanced neural activity in the reward system of the brain suggested that they were indeed amused.</p> <p>They were also scanned when they completed a questionnaire";;;;;;;;;;;;;;;;;;;;;;;;;;;
