id;type;section_id;section_name;web_publication_date;web_title;web_url;api_url;tags;is_hosted;pillar_id;pillar_name;headline;standfirst;trail_text;byline;main;body;newspaper_page_number;wordcount;comment_close_date;commentable;first_publication_date;is_inappropriate_for_sponsorship;is_premoderated;last_modified;newspaper_edition_date;production_office;publication;short_url;should_hide_adverts;show_in_related_content;thumbnail;legally_sensitive;lang;is_live;body_text;char_count;should_hide_reader_revenue;show_affiliate_links;byline_html;live_blogging_now;allow_ugc;sensitive;
lifeandstyle/2021/nov/14/ask-philippa-perry-i-have-been-ill-and-alone-now-relationships-seem-meaningless;article;lifeandstyle;Life and style;2021-11-14T05:00:26Z;I’ve been ill and alone – now relationships seem meaningless | Philippa Perry;https://www.theguardian.com/lifeandstyle/2021/nov/14/ask-philippa-perry-i-have-been-ill-and-alone-now-relationships-seem-meaningless;https://content.guardianapis.com/lifeandstyle/2021/nov/14/ask-philippa-perry-i-have-been-ill-and-alone-now-relationships-seem-meaningless;;FALSE;pillar/lifestyle;Lifestyle;I’ve been ill and alone – now relationships seem meaningless;Reprogramme your thinking from “everyone is horrible” to “everyone is lovely”, says Philippa Perry. It can turn your life around;Reprogramme your thinking from “everyone is horrible” to “everyone is lovely”, says Philippa Perry. It can turn your life around;Philippa Perry;"<figure class=""element element-image element--showcase"" data-media-id=""d74e64a152ca2df35e49ba950ce4373402dd21a7""> <img src=""https://media.guim.co.uk/d74e64a152ca2df35e49ba950ce4373402dd21a7/712_674_4340_2605/1000.jpg"" alt=""Smiling women drinking coffee and talking at restaurant table"" width=""1000"" height=""600"" class=""gu-image"" /> <figcaption> <span class=""element-image__caption"">‘Next time you are at a gathering think, “Everyone is interesting and attractive and pleased to see me and I’m interesting, valuable and attractive.”’</span> <span class=""element-image__credit"">Photograph: Justin Pumfrey/Getty Images</span> </figcaption> </figure>";"<p><em><strong>The dilemma</strong></em><strong> </strong><em>I’m only now able to get back into society after 20 months of having to isolate. Due to medical complications, I was only recently vaccinated and had been completely solitary out of fear of dealing with Covid</em><em>. I was ill with a life-threatening infection at one point during lockdown and luckily got through that, but it showed me how alone and vulnerable I am.</em></p> <p><em>I have also been made redundant. I have been applying for jobs, and going to interviews. Inevitably, I am being rejected and even when I’m not, my value is being questioned and negotiated down.</em></p> <p><em>I feel so let down by what I thought were solid friendships. Colleagues and friends dropped me when I could not offer them work due </em><em>to losing my job. You are totally on your own in life and relationships are all meaningless.</em></p> <p><em>At 39, I’ve given up on the idea of a romantic relationship and having a family. </em><em>Men want to know on the first date whether you’re attracted to them – it takes me longer to know. It’s as though there’s no value given to nurturing relationships. I’m not looking for anything major, just responding either way to a text suggesting meeting up for a stroll, being available for a laugh and chat</em><em> from time to time, or to go on a date without expectations.</em></p> <p><em>The door to the world might now be open but I am struggling to go through it.</em></p> <p><em><strong>Philippa’s answer </strong></em>I’m sorry, you’ve had more than your fair share of knockbacks and illness and isolation.</p> <p>We can have some bad experiences dating, or with people we thought were friends and it’s natural we think that this is a pattern and that all experiences will be like this in one way or another, proving to you that humans are somehow bad, and relationships meaningless. Our challenge in circumstances like these is to not lose our faith in the inherent goodness of most people.</p> <p>When a pack animal is taken from their group and isolated then reintroduced, they don’t throw themselves back into the centre, they stay on the periphery, don’t take risks and they stay relatively isolated. This experiment has been done with rats and with fruit flies. And I don’t think humans are much different. Isolation and loneliness makes us wary of others, distrustful. If something happens once or twice we can experience it as a pattern, and we withdraw to protect ourselves from it happening again. We become wary of being vulnerable to shield ourselves from further rejection. And we can make very reasonable-sounding excuses to do this – just like you presented me with your evidence. Reasoning can become our enemy when we use it to back up our instinct to shy away from new people after a period of isolation.</p>  <aside class=""element element-pullquote element--supporting""> <blockquote> <p>Our task is to not lose faith in the inherent goodness of most people</p> </blockquote> </aside>  <p>But we have the edge on fruit flies and rats because we can also use our powers of reason to override those instincts which tell us to hide. We can lead with the brain instead of with our instincts.</p> <p>There is also the danger of the self-fulfilling prophecy. If you go to a gathering of people and you think as you enter the space, “Nobody likes me, no one wants to talk to me, relationships are meaningless,” how would that show in your body language? What vibes would you be giving off? You’d probably stay on the edges, avoid eye contact and be guarded in any conversations. Now suppose instead you think, “Everyone is interesting and attractive and pleased to see me and I’m interesting, valuable and attractive. I want to talk to them about what I’m thinking, and I want to find out what they are thinking about,” then how would that show in your face, body language, eye-contact and the vibe you give off? It’ll make you more approachable, friendlier and relatable.</p> <p>Both scenarios are speculative fantasy but I <em>always</em> say if you are going to have a fantasy about other people make it a good one. Make it the best one and believe it and it will show in your face and it will turn your life right around. How do I know this will work for you? I cannot possibly know, but I believe it. I’ve done it, my clients have done it and I get very excited about it. If you cannot do it, go to a hypnotherapist until you can. Reprogramming yourself from “everyone is horrible” to “everyone is lovely” can make the biggest difference in your life. You may find it easy or it might take all your courage to flip this switch. You’ll need to turn your attention away from the evidence you’ve cherrypicked which backed up the stories you used to tell yourself about relationships and look the other way towards hopefulness and evidence that some seeds do germinate (but they won’t if you don’t sow them).</p> <p>Now, repeat after me: “everyone is interesting and attractive including you and me and we are all very pleased to see each other”. It will take practice. You have acclimatised to “everyone is not worth the effort” because you’ve practised that. Time to upgrade to your next self-fulfilling prophecy. We only have one life (apparently) – don’t be a fruit fly. </p> <p><em>If you have a question, send a brief email to <a href=""mailto:askphilippa@observer.co.uk"">askphilippa@observer.co.uk</a></em></p>";58;885;2021-11-14T15:45:00Z;TRUE;2021-11-14T05:00:26Z;FALSE;TRUE;2021-11-14T16:29:31Z;14/11/21;UK;The Observer;https://www.theguardian.com/p/jgtfg;FALSE;TRUE;https://media.guim.co.uk/d74e64a152ca2df35e49ba950ce4373402dd21a7/712_674_4340_2605/500.jpg;FALSE;en;TRUE;The dilemma I’m only now able to get back into society after 20 months of having to isolate. Due to medical complications, I was only recently vaccinated and had been completely solitary out of fear of dealing with Covid. I was ill with a life-threatening infection at one point during lockdown and luckily got through that, but it showed me how alone and vulnerable I am. I have also been made redundant. I have been applying for jobs, and going to interviews. Inevitably, I am being rejected and even when I’m not, my value is being questioned and negotiated down. I feel so let down by what I thought were solid friendships. Colleagues and friends dropped me when I could not offer them work due to losing my job. You are totally on your own in life and relationships are all meaningless. At 39, I’ve given up on the idea of a romantic relationship and having a family. Men want to know on the first date whether you’re attracted to them – it takes me longer to know. It’s as though there’s no value given to nurturing relationships. I’m not looking for anything major, just responding either way to a text suggesting meeting up for a stroll, being available for a laugh and chat from time to time, or to go on a date without expectations. The door to the world might now be open but I am struggling to go through it. Philippa’s answer I’m sorry, you’ve had more than your fair share of knockbacks and illness and isolation. We can have some bad experiences dating, or with people we thought were friends and it’s natural we think that this is a pattern and that all experiences will be like this in one way or another, proving to you that humans are somehow bad, and relationships meaningless. Our challenge in circumstances like these is to not lose our faith in the inherent goodness of most people. When a pack animal is taken from their group and isolated then reintroduced, they don’t throw themselves back into the centre, they stay on the periphery, don’t take risks and they stay relatively isolated. This experiment has been done with rats and with fruit flies. And I don’t think humans are much different. Isolation and loneliness makes us wary of others, distrustful. If something happens once or twice we can experience it as a pattern, and we withdraw to protect ourselves from it happening again. We become wary of being vulnerable to shield ourselves from further rejection. And we can make very reasonable-sounding excuses to do this – just like you presented me with your evidence. Reasoning can become our enemy when we use it to back up our instinct to shy away from new people after a period of isolation. But we have the edge on fruit flies and rats because we can also use our powers of reason to override those instincts which tell us to hide. We can lead with the brain instead of with our instincts. There is also the danger of the self-fulfilling prophecy. If you go to a gathering of people and you think as you enter the space, “Nobody likes me, no one wants to talk to me, relationships are meaningless,” how would that show in your body language? What vibes would you be giving off? You’d probably stay on the edges, avoid eye contact and be guarded in any conversations. Now suppose instead you think, “Everyone is interesting and attractive and pleased to see me and I’m interesting, valuable and attractive. I want to talk to them about what I’m thinking, and I want to find out what they are thinking about,” then how would that show in your face, body language, eye-contact and the vibe you give off? It’ll make you more approachable, friendlier and relatable. Both scenarios are speculative fantasy but I always say if you are going to have a fantasy about other people make it a good one. Make it the best one and believe it and it will show in your face and it will turn your life right around. How do I know this will work for you? I cannot possibly know, but I believe it. I’ve done it, my clients have done it and I get very excited about it. If you cannot do it, go to a hypnotherapist until you can. Reprogramming yourself from “everyone is horrible” to “everyone is lovely” can make the biggest difference in your life. You may find it easy or it might take all your courage to flip this switch. You’ll need to turn your attention away from the evidence you’ve cherrypicked which backed up the stories you used to tell yourself about relationships and look the other way towards hopefulness and evidence that some seeds do germinate (but they won’t if you don’t sow them). Now, repeat after me: “everyone is interesting and attractive including you and me and we are all very pleased to see each other”. It will take practice. You have acclimatised to “everyone is not worth the effort” because you’ve practised that. Time to upgrade to your next self-fulfilling prophecy. We only have one life (apparently) – don’t be a fruit fly. If you have a question, send a brief email to askphilippa@observer.co.uk;4952;FALSE;TRUE;"<a href=""profile/philippa-perry"">Philippa Perry</a>";NA;NA;NA;
lifeandstyle/2021/nov/07/ask-philippa-perry-what-do-i-say-to-my-estranged-daughter-after-years-apart;article;lifeandstyle;Life and style;2021-11-07T05:00:11Z;What do I say to my estranged daughter after years apart? | Ask Philippa;https://www.theguardian.com/lifeandstyle/2021/nov/07/ask-philippa-perry-what-do-i-say-to-my-estranged-daughter-after-years-apart;https://content.guardianapis.com/lifeandstyle/2021/nov/07/ask-philippa-perry-what-do-i-say-to-my-estranged-daughter-after-years-apart;;FALSE;pillar/lifestyle;Lifestyle;What do I say to my estranged daughter after years apart?;Try to imagine events through her eyes. If you hold on to your position, believing her to be selfish, nothing will change;Try to imagine events through her eyes. If you hold on to your position, believing her to be selfish, nothing will change;Philippa Perry;"<figure class=""element element-image element--showcase"" data-media-id=""16a58792eae0787c670fb9e229f5ba03aed65f33""> <img src=""https://media.guim.co.uk/16a58792eae0787c670fb9e229f5ba03aed65f33/0_248_7360_4415/1000.jpg"" alt=""Shot of a young woman spending quality time with her father on the sofa at home"" width=""1000"" height=""600"" class=""gu-image"" /> <figcaption> <span class=""element-image__caption"">‘You are more than someone who just provided";;;;;;;;;;;;;;;;;;;;;;;;;;;;
lifeandstyle/2021/oct/31/ask-philippa-perry-i-do-not-want-my-first-polyamorous-relationship-to-end;article;lifeandstyle;Life and style;2021-10-31T04:00:18Z;I don’t want my first polyamorous relationship to end | Ask Philippa;https://www.theguardian.com/lifeandstyle/2021/oct/31/ask-philippa-perry-i-do-not-want-my-first-polyamorous-relationship-to-end;https://content.guardianapis.com/lifeandstyle/2021/oct/31/ask-philippa-perry-i-do-not-want-my-first-polyamorous-relationship-to-end;;FALSE;pillar/lifestyle;Lifestyle;I don’t want my first polyamorous relationship to end;You could talk about it – and tell the other two that you won’t have secrets that make one of them feel not great;You could talk about it – and tell the other two that you won’t have secrets that make one of them feel not great;Philippa Perry;"<figure class=""element element-image"" data-media-id=""974279d536bb30358cdce27b0d817ff2ce263291""> <img src=""https://media.guim.co.uk/974279d536bb30358cdce27b0d817ff2ce263291/0_276_4288_2572/1000.jpg"" alt=""many feet in bed"" width=""1000"" height=""600"" class=""gu-image"" /> <figcaption> <span class=""element-image__caption"">Three’s company: ‘I don’t want to waste what we had.’</span> <span class=""element-image__credit"">Photograph: Getty Images</span> </figcaption> </figure>";<p><em><strong>The question </strong>For 18 months I’ve been in a relationship with two other men. They’d been a couple for five years already. We made it work and moved in together. We are all in our early 30s. I have never had a relationship longer than a few weeks before this.</em></p> <p><em>The attraction was equally sparkling for both of them at the start but, as time went by, I developed more of a sexual connection with ‘B’, many times being very spontaneous just between the two of us, always with almost a “cheating thrill”. We had threesomes as well.</em></p> <p><em>‘A’ is loving and caring and I love living with him, too. They brought the stability, warmth and care</em><em>;;;;;;;;;;;;;;;;;;;;;;;;;;;
lifeandstyle/2021/oct/24/ask-philippa-perry-i-used-to-have-a-rewarding-life-but-now-i-feel-stuck;article;lifeandstyle;Life and style;2021-10-24T03:00:02Z;I used to have a rewarding life, but now I feel stuck;https://www.theguardian.com/lifeandstyle/2021/oct/24/ask-philippa-perry-i-used-to-have-a-rewarding-life-but-now-i-feel-stuck;https://content.guardianapis.com/lifeandstyle/2021/oct/24/ask-philippa-perry-i-used-to-have-a-rewarding-life-but-now-i-feel-stuck;;FALSE;pillar/lifestyle;Lifestyle;I used to have a rewarding life, but now I feel stuck;You are in that scary place of not knowing how to be. But have faith, says Philippa Perry;You are in that scary place of not knowing how to be. But have faith, says Philippa Perry;Philippa Perry;"<figure class=""element element-image"" data-media-id=""bbb3a358951fde86833dbfb81694aac4f66d4eb9""> <img src=""https://media.guim.co.uk/bbb3a358951fde86833dbfb81694aac4f66d4eb9/207_563_3961_2376/1000.jpg"" alt=""Young asian smiling couple having fun outdoors.Young asian smiling couple having fun outdoors at summer,"" width=""1000"" height=""600"" class=""gu-image"" /> <figcaption> <span class=""element-image__caption"">Flying high: ‘I need a reset, but can’t seem to get a new job, relationship or the sense of achievement I once had.’</span> <span class=""element-image__credit"">Photograph: Evgeniia Siiankovskaia/Getty Images</span> </figcaption> </figure>";"<p><em><strong>The question</strong></em> <em>I seem to have lost all momentum in my life and I don’t know what to do. Until a couple of years ago, I had a stressful but rewarding life working abroad and travelling</em><em>. I had a long-distance relationship and friends </em><em>around the </em><em>world. Then my relationship broke up, my father died and Covid happened. Because of the pandemic my company limited my job to a desk-only role, and they are happy with that despite me doing almost nothing. My family struggled at first without my dad, so I spent time supporting them, but now</em><em> </em><em>they’re in a good place, so I’m not needed</em><em>.</em></p> <p><em>A lot of my friends settled during this time. They’ve now got dogs, marriages and kids and, although I’m happy for them, it means they are less available</em><em>. Covid stopped my dating life, except online </em><em>where the women</em><em> all seem to be looking for someone to settle down with.</em></p> <p><em>Friends</em><em> see that I’m doing very well from the outside</em><em> – I’m still getting matches on dating apps, I live in a nice place and earn more than I spend and don’t really see how I could have a problem, but it feels like I’m just stagnating while everyone else is moving on. </em><em>I need a reset, but can’t </em><em>get a new job, relationship or the sense of achievement I once had.</em></p> <p><em><strong>Philippa’s answer</strong></em> Bloody pandemic. You had a great life, stressful, but you seemed to thrive on the adrenaline. You scooted around the world having fleeting contact with a great number of friends and had a long-distance relationship. That has all changed and the change was outside your control. You have suffered three significant losses: the death of your father, the end of your relationship and a curtailing of your previous lifestyle. You are allowed to grieve, feel these losses and give yourself time to get over the shock of them and time to adapt to a different life. I’m not surprised you feel less than great. Sure, you are neither broke, friendless nor homeless, but that doesn’t mean you are not suffering.</p> <p>How you relate with people has also altered. Pre-pandemic the norm for your social life seems to have been lots of brief contact, but now everyone around you is getting into deeper connections. And perhaps a long-distance relationship suited you, too. More excitement when you infrequently got together, rather than taking time to know each other on a more meaningful level?</p>  <aside class=""element element-pullquote element--supporting""> <blockquote> <p>Your family, you say, doesn’t need you any more. That doesn’t mean that you are not allowed to need them</p> </blockquote> </aside>  <p>You have lost your father. Your family mourned and began to move on, but what about you? Did you mourn or did you just comfort the mourners? You are allowed to be vulnerable and sad, too. Your family, you say, doesn’t need you any more. That doesn’t mean that you are not allowed to need them. You don’t always have to play the role of the strong one. I wonder whether you tell yourself it isn’t appropriate for you to have needs as well?</p> <p>At work everyone is happy with you when you are doing almost nothing. I’d go further, I’d bet your family is happy with you when you do absolutely nothing. You belong";;;;;;;;;;;;;;;;;;;;;;;;;;;
