id;type;section_id;section_name;web_publication_date;web_title;web_url;api_url;tags;is_hosted;pillar_id;pillar_name;headline;standfirst;trail_text;byline;main;body;newspaper_page_number;wordcount;comment_close_date;commentable;first_publication_date;is_inappropriate_for_sponsorship;is_premoderated;last_modified;newspaper_edition_date;production_office;publication;short_url;should_hide_adverts;show_in_related_content;thumbnail;legally_sensitive;lang;is_live;body_text;char_count;should_hide_reader_revenue;show_affiliate_links;byline_html;live_blogging_now;allow_ugc;sensitive;
lifeandstyle/2022/mar/27/ask-philippa-perry-our-relationship-was-bad-so-why-cant-i-get-over-my-ex;article;lifeandstyle;Life and style;2022-03-27T03:00:16Z;Our relationship was bad, so why can’t I get over my ex? | Ask Philippa;https://www.theguardian.com/lifeandstyle/2022/mar/27/ask-philippa-perry-our-relationship-was-bad-so-why-cant-i-get-over-my-ex;https://content.guardianapis.com/lifeandstyle/2022/mar/27/ask-philippa-perry-our-relationship-was-bad-so-why-cant-i-get-over-my-ex;;FALSE;pillar/lifestyle;Lifestyle;Our relationship was bad, so why can’t I get over my ex?;You tried to fit this man into your dream – and it’s the loss of the dream you are mourning, says Philippa Perry;You tried to fit this man into your dream – and it’s the loss of the dream you are mourning, says Philippa Perry;Philippa Perry;"<figure class=""element element-image"" data-media-id=""623812dc9f6a9aba558e388e83712134489d088b""> <img src=""https://media.guim.co.uk/623812dc9f6a9aba558e388e83712134489d088b/0_89_4000_2400/1000.jpg"" alt=""Green Frog, Toronto, Canada - 10 Aug 2021Mandatory Credit: Photo by Creative Touch Imaging Ltd/NurPhoto/REX/Shutterstock (12256649g) Green Frog (Lithobates clamitans) peaking its head out above some duckweed in a small pond in Toronto, Ontario, Canada, on August 10, 2021. Green Frog, Toronto, Canada - 10 Aug 2021"" width=""1000"" height=""600"" class=""gu-image"" /> <figcaption> <span class=""element-image__caption"">‘I love your frog metaphor. You haven’t been boiled to death, you escaped while the water was getting warm. Now look around you at the other frogs and enjoy their company and enjoy yourself.’</span> <span class=""element-image__credit"">Photograph: Creative Touch/Rex/Shutterstock</span> </figcaption> </figure>";<p><em><strong>The question</strong></em><strong> </strong><em>I don’t know how to get over my ex. I feel as if the breakup has been like a frog being slowly boiled to death</em><em> – I didn’t see it coming and it got progressively worse.</em></p> <p><em>In September, we had a holiday abroad together and he enquired about apartments and asked me to think about whether it was a place I could see myself moving to. We had also agreed that I would come off the pill in a couple of months. He came with me to </em><em>two weddings and my family said how happy we seemed.</em></p> <p><em>Then he visited a friend in the US and came back whingeing that I wasn’t physical enough and we didn’t have enough sex. Since then he has run away from me. How am I supposed to get closure if he won’t speak to me?</em></p> <p><em>Also, money has been an issue. He is on a six-figure salary, and has judged me throughout our relationship </em><em>because I have not sought a better-paid job. Sex has always been bad – and I was willing to fake orgasms for the rest of my life to be with him. It doesn’t make sense because he was never adventurous or willing to talk about </em><em>experimenting or </em><em>switching things up in the bedroom. I am drawing </em><em>the conclusion that he has enjoyed wasting my time and suddenly had enough, but I can’t get over him. He is one of few long-term relationships I have had. He clearly doesn’t give a damn about me. I am mourning the loss of my lifelong need to have a family. I am 39, so my time for children is running out. How do I climb out of this abyss?</em></p> <p><em><strong>Philippa’s answer </strong></em>It must be disappointing that your dream of having a family with this man has come crashing down. I’m sorry you are feeling broken-hearted, and angry. You wanted a long-term relationship and a family. You felt time was running out, but then he came along and you found someone to have it with. At that time, you were deaf to the alarm bells.</p> <p>You say he doesn’t give a damn about you. I’m sorry, this is going to sound harsh, but I’m not sure how much you care for him either. I think it may have been more about what this man represented for you – a lifeline to the possibility of realising your ambition of a family. It does sound as if you have been blind to the cracks already showing: sexual incompatibility;;;;;;;;;;;;;;;;;;;;;;;;;;;
money/2022/mar/20/ask-philppa-perry-i-cant-face-working-back-in-the-office-they-are-all-so-horrible;article;money;Money;2022-03-20T05:00:49Z;I can’t face going back to work in the office;https://www.theguardian.com/money/2022/mar/20/ask-philppa-perry-i-cant-face-working-back-in-the-office-they-are-all-so-horrible;https://content.guardianapis.com/money/2022/mar/20/ask-philppa-perry-i-cant-face-working-back-in-the-office-they-are-all-so-horrible;;FALSE;pillar/lifestyle;Lifestyle;I can’t face going back to work in the office;It’s time to gently push out the edges of your comfort zone;It’s time to gently push out the edges of your comfort zone, says Philippa Perry;Philippa Perry;"<figure class=""element element-image"" data-media-id=""cf43bb6bb16d61d77dbd8bd23e6153bed7e113ff""> <img src=""https://media.guim.co.uk/cf43bb6bb16d61d77dbd8bd23e6153bed7e113ff/0_71_2120_1273/1000.jpg"" alt=""Business people using technology in meeting"" width=""1000"" height=""600"" class=""gu-image"" /> <figcaption> <span class=""element-image__caption"">Working 9 to 5: ‘It’s time to be a little bit more optimistic about what people are like.’</span> <span class=""element-image__credit"">Photograph: Getty Images</span> </figcaption> </figure>";"<p><em><strong>The question </strong>I have realised that after two years of working from home I cannot work in an office. My manager has recently mandated that we all work from the office on certain days of the week. I now spend half an hour each way crammed into a smelly, dirty train. I started this job during the pandemic, so I was nervous to go into the office and meet my colleagues. Well, my worst fears came true, because on my first day, the first colleague I met tried to get me fired. He said I wasn’t wearing my lanyard and reported it to my boss.</em></p> <p><em>Since then I’ve met the rest of the team and I experienced a not insubstantial amount of sectarianism and sexism. But it’s not just that. I now find I’m hypersensitive to any noise. I’m acutely sensitive to people chewing with their mouths open, slurping soup and gossiping loudly. Not only that, but my stomach rumbles and I find it excruciatingly embarrassing. I want the ground to swallow me up. Working from home, none of this was an issue. I can’t go on like this. Aside from getting a medical certificate, which I obviously don’t want to do, how can I approach my office to request I work from home permanently?</em></p> <p><em><strong>Philippa’s answer </strong></em>There are many like you who got used to working from home. Comfort zones for being with colleagues appear to have, in many people’s experience, diminished.</p> <p>During the pandemic, it was repeatedly implied to us that other people were dangerous, potential killers, even. Shops and offices are still full of signs reminding us to keep our distance and wash our hands. Every factual TV series made since the pandemic shows people standing far apart from each other with an unnatural distance. This is all very sensible as a precaution against the virus, but what has it done to our psyches? It has reinforced any anxiety we may have had about others and made us more wary of our fellow human beings. It makes me sad.</p> <p>After so long being on our own, the sounds and smells of other people may very well feel jarring. We got used to the quiet and now normal noise feels horribly over-stimulating and the situation has made us even more conscious of the normal noises our bodies make. Many people report feeling overstimulated and exhausted after re-entry post lockdown. I was among them. Many of us have had to build up again gradually, and I think you will need to do this, too.</p> <p>Like many creatures, human beings are pack animals. If you remove a fruit fly from its fellow fruit flies, isolate it and then re-introduce it into the swarm, it doesn’t plunge back into the centre, but hides around the edges. It is as though it got used to loneliness and dare not risk what might feel like further rejection by diving back in. I’ve heard the same thing happens with rats, and for sure after isolation we humans feel shyer and hypervigilant for potential rejection.</p>  <aside class=""element element-pullquote element--supporting""> <blockquote> <p>I don’t think you’ll get fired for forgetting your lanyard</p> </blockquote> </aside>  <p>There are two things we can do with these feelings of fear and distrust: we can be ruled by the feeling and stay hidden, or we can feel the fear and join in anyway. If we hide, we carry on feeding our fears, but if we dare to feel them and act in spite of them, they will gradually diminish as we establish relationships and re-enter the fray, even when we had believed we would not.</p> <p>I don’t think you’ll get fired for forgetting your lanyard. How kind of your colleague to ask your boss if you had been issued with one (there’s always another interpretation for a story). Forming cliques is universal within all human groups and we won’t educate anyone about sexism by hiding away. It can be awkward joining a group that is already established, as relationships take time. But what is good about them at work is that the cliché of two brains being better than one is true. We can have video meetings, but so much more creativity and problem-solving happens chatting by the water cooler.</p> <p>When you enter a full room and think no one will be interested in you and other people are all horrible, what vibe do you give off? But if you walk in expecting everyone to be kind, interesting and attractive and you are, too, how different would your demeanour be? And what difference would that make to the experience?</p> <p>I doubt there is harm in telling your boss that you work better at home, but it’s not guaranteed to work. I would encourage you, instead, to realise not all humans are all bad, and some of them are really great and will be fun and interesting to work with.</p> <p>You have been searching for evidence to the contrary";;;;;;;;;;;;;;;;;;;;;;;;;;;
lifeandstyle/2022/mar/13/ask-philippa-perry-why-am-i-so-floored-by-the-death-of-my-first-long-ago-love;article;lifeandstyle;Life and style;2022-03-13T05:00:21Z;Why am I so floored by the death of my first, long ago, love? | Ask Philippa;https://www.theguardian.com/lifeandstyle/2022/mar/13/ask-philippa-perry-why-am-i-so-floored-by-the-death-of-my-first-long-ago-love;https://content.guardianapis.com/lifeandstyle/2022/mar/13/ask-philippa-perry-why-am-i-so-floored-by-the-death-of-my-first-long-ago-love;;FALSE;pillar/lifestyle;Lifestyle;Why am I so floored by the death of my first, long ago, love?;Even though you’re now a happily married middle-aged man, there is a teenage lovelorn boy inside you. Be kind to him;Even though you’re now a happily married middle-aged man, there is a teenage lovelorn boy inside you. Be kind to him;Philippa Perry;"<figure class=""element element-image"" data-media-id=""2c673c97841f4abbd133067d7049c012a83f4ad3""> <img src=""https://media.guim.co.uk/2c673c97841f4abbd133067d7049c012a83f4ad3/0_33_6192_3715/1000.jpg"" alt=""Close up picture of mans and womans handsTogether. Close up picture of mans and womans hands"" width=""1000"" height=""600"" class=""gu-image"" /> <figcaption> <span class=""element-image__caption"">‘Luckily, you have a lovely person on-hand to help you with this. Talk to your wife.’</span> <span class=""element-image__credit"">Photograph: Zinkevych/Getty Images/iStockphoto</span> </figcaption> </figure>";"<p><em><strong>The questions </strong>Just over 20 years ago, I fell truly and madly for a girl, N. We circled around each other for a summer, but never got together. We did acknowledge our attraction, but were both due to start university</em><em>. After a kiss, we agreed it was bad timing. Out of fear of rejection, I </em><em>never t</em><em>old her how deep my feelings </em><em>went.</em></p> <p><em>We saw each other on university holidays, and an affinity remained, however she quickly appeared to move on. I pined for her deeply. No one I met </em><em>compared. Long sessions of listening-to-depressing-love-songs-type stuff.</em></p> <p><em>I eventually ended up in a relationship. This was fine. It felt like moving on, until N and I got together one drunken evening. Afterwards, we agreed it was a mistake and carried on with our lives. I ended the relationship I was in</em><em>.</em></p> <p><em>We </em><em>met a few times over the next few years, but slowly lost touch. I met a wonderful person</em><em> and got married and have </em><em>incredible kids. I </em><em>am very much in love with my wife. My thoughts of my first love remained affectionate, but in a platonic and sporadic way.</em></p> <p><em>I recently found out that N has died, leaving behind a </em><em>family. </em><em>The strength of my reaction has taken me by surprise. I have been completely floored by it and cannot stop thinking of her. I find my mind going to what I could and should have said more 20 years ago. I have only passingly discussed </em><em>this with my wife</em><em>, and not my inner thoughts,</em><em> as I fear it sounds over-the-top and a betrayal to her. How do I rationalise the strength of these feelings I thought I had left behind 15 years ago? I just want to remember N fondly, as she deserves to be remembered.</em></p> <p><em><strong>Philippa’s answer </strong></em>I see it like this: you still have that teenage boy inside you, even though you are now a happily married middle-aged man. You need to be very kind to this lovelorn boy: he believes he has just lost the love of his life, he needs to weep and he needs to be held. Luckily, you have a lovely person on-hand to help you with this. You’ve just got to talk to her. Parts of ourselves don’t die just because we move on, they remain dormant until something reignites them. Old men on their deathbeds call for their mothers and you cannot but feel deeply for them.</p> <p>There is a hint in your email that you might be worried about part of you being unacceptable to others. You seem to have some sort of belief that says something like, “If you really knew me, you would not approve of me.” And it seems to me that this might have been part of what held you back from being truly open with N, and now I’m wondering if you are projecting this belief on to your wife. There are lines in your letter that suggest you love your life, and that you love your wife, and because you say things like you thought about N “in a platonic and sporadic way”, I would guess your wife would not be offended if you showed her the email you wrote to me. Maybe even show her my reply, too, because I would think she might be a good person to facilitate your grieving.</p>  <aside class=""element element-pullquote element--supporting""> <blockquote> <p>There were things you didn’t say – you need to hear them yourself</p> </blockquote> </aside>  <p>There are feelings that are difficult to rationalise. That doesn’t mean they don’t make sense. What is wonderful about the bonds we create is that they can go beyond words and this is possibly why we keep trying to articulate such feelings in poetry and love songs. You sound like a rational person, so something you cannot make sense of might feel like a sort of craziness, but I don’t think it is. You certainly did have unfinished business with N";;;;;;;;;;;;;;;;;;;;;;;;;;;
lifeandstyle/2022/mar/06/ask-philippa-perry-i-dont-know-how-to-be-me-how-do-i-find-myself;article;lifeandstyle;Life and style;2022-03-06T05:00:45Z;I don’t know how to be me. How do I find myself? | Ask Philippa;https://www.theguardian.com/lifeandstyle/2022/mar/06/ask-philippa-perry-i-dont-know-how-to-be-me-how-do-i-find-myself;https://content.guardianapis.com/lifeandstyle/2022/mar/06/ask-philippa-perry-i-dont-know-how-to-be-me-how-do-i-find-myself;;FALSE;pillar/lifestyle;Lifestyle;I don’t know how to be me. How do I find myself?;Practice saying self-revelatory thoughts to another person without knowing how they are going to land, says Philippa Perry. And tune into your own feelings;Practice saying self-revelatory thoughts to another person without knowing how they are going to land, says Philippa Perry. And tune into your own feelings;Philippa Perry;"<figure class=""element element-image"" data-media-id=""13f8ffc308118e92c4d6317fe3be1b649c2876fe""> <img src=""https://media.guim.co.uk/13f8ffc308118e92c4d6317fe3be1b649c2876fe/0_13_3558_2135/1000.jpg"" alt=""Loving young couple holding hands and talking over coffee outdoors"" width=""1000"" height=""600"" class=""gu-image"" /> <figcaption> <span class=""element-image__caption"">‘Dare to share. It is a risk. But without allowing ourselves to be really seen, a potential partner won’t be able to really connect with us.’</span> <span class=""element-image__credit"">Photograph: Alamy</span> </figcaption> </figure>";"<p><em><strong>The question </strong>My partner broke up with me after being together throughout the pandemic and, at the end, part of her reasoning was that she felt she “didn’t really know who I am”.</em></p> <p><em>I recently started seeing someone new and, although we’ve only known each other for a month, she said the same thing unprompted. Truthfully, I feel the same way about myself. I’m 30 and I’ve always felt subdued and unable to be expressive. I don’t know how to be authentically me</em><em>. How do I find myself?</em></p> <p><em>I worry that I don’t have the right things to say and that girlfriends will either be bored by or put off by what I share, so I share as little as possible (not always, but it is my natural inclination). I also shy away from conflict. I’m not good at expressing myself and I think if I speak, I’ll only make things worse.</em></p> <p><em><strong>Philippa’s answer </strong></em>I wonder if you feel that if you are yourself, you may put another person off. But if we never take the risk of putting the other person off, we never give ourselves the opportunity of letting ourselves be known. To be known we have to be seen. We will never be seen if we hide. To truly connect with others we need to be, not who we think we ought to be, but who we really are. You are worried about being boring. In my experience in the psychotherapy room and outside it, people are more likely to be boring when they are not taking the risk of being real. In other words, I want you to work on developing a tolerance for being vulnerable.</p> <p>One of the ways to increase wisdom and connection is to speak in the moment and work out things in conversation, rather than thinking we have to have everything right before we speak. This means not filtering all your thoughts: instead, say, “I love you,” or try to articulate other scary, self-revelatory thoughts without knowing how they are going to land. You can work out how you feel, not always on your own in your head, but in relationship with another. Say things spontaneously for the first time before you’ve thought them through. Practise being yourself and being unsure how you’ll be received. Dare to share. Is this a fail-safe formula? No. It is a risk. But without allowing ourselves to be really seen, a potential partner won’t be able to really connect with us. So, in my view, it’s a risk worth taking. </p>  <aside class=""element element-pullquote element--supporting""> <blockquote> <p>Speak in the moment rather than filtering all your thoughts</p> </blockquote> </aside>  <p>In response to our earliest environment, we develop coping strategies and these become ingrained habits. What may have got you through early on – may have even earned you the appellation of “good boy!” – might have been “sharing as little as possible”. But what might have been a self-preserving policy in the past can become a self-defeating policy in the present. You say not sharing is your “natural inclination”. It could be just early adaptation, therefore ingrained rather than natural.</p> <p>Adapting to other people is a skill, and I suspect one you have in so much abundance that you might have lost some of yourself. Some people need to learn how to adapt and turn up the adaptation dial, while others – you seem to be among them – need to turn it down. If you adapt so completely to the other person, there is nothing left of you for them to have a relationship with. It is even hard for you to have a relationship with yourself. I expect you are putting in more energy to work out the other’s feelings than giving yourself attention to figure out your own.</p> <p>Perhaps conflict is difficult for you because you have difficulty in knowing what you feel. Conflicts are usually far more about how we each feel than they are about facts. There will be conflicts in any relationship as we all experience things differently. It’s better if we can think of differences, not so much as I’m right, they’re wrong, winning and losing, but as an opportunity to gain understanding of the other’s view point and to communicate how you feel about yours. Then, considering your and their feelings, work together for compromise. If conflict is completely avoided, not talked about, never aired, a relationship can shrink because, as subjects become taboo, it means there will be less and less to talk about and areas of loneliness creep in where each of you remain unseen.</p> <p>I’m wondering if you are numb where feelings are concerned. You don’t say how you feel about your break-up. Perhaps you learned to numb emotion because to have your feelings meant having pain. Trouble is, we cannot just numb hurt and pain without numbing joy as well. I think you need to work on turning up your feelings dial. You don’t have to go from zero to 10";;;;;;;;;;;;;;;;;;;;;;;;;;;
